<?xml version="1.0" encoding="UTF-8"?>
<testCases xmlns="http://www.omg.org/spec/DMN/20160719/testcase" xmlns:xsi="http://www.w3.org/2001/XMLSchema-instance" xsi:schemaLocation="http://www.omg.org/spec/DMN/20160719/testcase ../../testCases.xsd" xmlns:xsd="http://www.w3.org/2001/XMLSchema">
	<modelName>0007-date-time.dmn</modelName>
	<labels>
		<label>Compliance Level 3</label>
		<label>Literal Expression</label>
		<label>Context</label>
		<label>Item Definition</label>
		<label>FEEL Functions: date and time</label>
		<label>FEEL Arithmetic</label>
		<label>FEEL Special-character Names</label>
		<label>Data Type: String</label>
		<label>Data Type: Number</label>
		<label>Data Type: Structure</label>
		<label>Data Type: Date</label>
		<label>Data Type: Time</label>
	</labels>
	<testCase id="001">
		<inputNode name="dateString">
			<value xsi:type="xsd:string">2015-12-24</value>
		</inputNode>
		<inputNode name="timeString">
			<value xsi:type="xsd:string">00:00:01-01:00</value>
		</inputNode>
		<inputNode name="dateTimeString">
			<value xsi:type="xsd:string">2016-12-24T23:59:00-08:00</value>
		</inputNode>
		<inputNode name="Hours">
			<value xsi:type="xsd:decimal">12</value>
		</inputNode>
		<inputNode name="Minutes">
			<value xsi:type="xsd:decimal">59</value>
		</inputNode>
		<inputNode name="Seconds">
			<value xsi:type="xsd:decimal">01.3</value>
		</inputNode>
		<inputNode name="Timezone">
			<value xsi:type="xsd:duration">-PT1H</value>
		</inputNode>
		<inputNode name="Year">
			<value xsi:type="xsd:decimal">1999</value>
		</inputNode>
		<inputNode name="Month">
			<value xsi:type="xsd:decimal">11</value>
		</inputNode>
		<inputNode name="Day">
			<value xsi:type="xsd:decimal">22</value>
		</inputNode>
		<inputNode name="oneHour">
			<value xsi:type="xsd:duration">PT1H</value>
		</inputNode>
		<inputNode name="durationString">
			<value xsi:type="xsd:string">P13DT2H14S</value>
		</inputNode>
		<resultNode name="Date-Time" type="decision">
			<expected>
				<value xsi:type="xsd:dateTime">2016-12-24T23:59:00-08:00</value>
			</expected>
		</resultNode>
		<resultNode name="Date" type="decision">
			<expected>
				<component name="fromString">
					<value xsi:type="xsd:date">2015-12-24</value>
				</component>
				<component name="fromDateTime">
					<value xsi:type="xsd:date">2016-12-24</value>
				</component>
				<component name="fromYearMonthDay">
					<value xsi:type="xsd:date">1999-11-22</value>
				</component>
			</expected>
		</resultNode>
		<resultNode name="Time" type="decision">
			<expected>
				<value xsi:type="xsd:time">00:00:01-01:00</value>
			</expected>
		</resultNode>
		<resultNode name="Date-Time2" type="decision">
			<expected>
				<value xsi:type="xsd:dateTime">2015-12-24T00:00:01-01:00</value>
			</expected>
		</resultNode>
		<resultNode name="Time2" type="decision">
			<expected>
				<value xsi:type="xsd:time">00:00:01-01:00</value>
			</expected>
		</resultNode>
		<resultNode name="Time3" type="decision">
			<expected>
				<value xsi:type="xsd:time">12:59:01.3-01:00</value>
			</expected>
		</resultNode>
		<resultNode name="dtDuration1" type="decision">
			<expected>
				<value xsi:type="xsd:duration">P13DT2H14S</value>
			</expected>
		</resultNode>
		<resultNode name="dtDuration2" type="decision">
			<expected>
				<value xsi:type="xsd:duration">P367DT6H58M59S</value>
			</expected>
		</resultNode>
		<resultNode name="sumDurations" type="decision">
			<expected>
				<value xsi:type="xsd:duration">P380DT8H59M13S</value>
			</expected>
		</resultNode>
		<resultNode name="ymDuration2" type="decision">
			<expected>
				<value xsi:type="xsd:duration">P1Y0M</value>
			</expected>
		</resultNode>
		<resultNode name="cDay" type="decision">
			<expected>
				<value xsi:type="xsd:decimal">24</value>
			</expected>
		</resultNode>
		<resultNode name="cYear" type="decision">
			<expected>
				<value xsi:type="xsd:decimal">2015</value>
			</expected>
		</resultNode>
		<resultNode name="cMonth" type="decision">
			<expected>
				<value xsi:type="xsd:decimal">12</value>
			</expected>
		</resultNode>
		<resultNode name="cHour" type="decision">
			<expected>
				<value xsi:type="xsd:decimal">0</value>
			</expected>
		</resultNode>
		<resultNode name="cMinute" type="decision">
			<expected>
				<value xsi:type="xsd:decimal">0</value>
			</expected>
		</resultNode>
		<resultNode name="cSecond" type="decision">
			<expected>
				<value xsi:type="xsd:decimal">1</value>
			</expected>
		</resultNode>
		<resultNode name="cOffset" type="decision">
			<expected>
				<value xsi:type="xsd:duration">-PT1H</value>
			</expected>
		</resultNode>
		<resultNode name="years" type="decision">
			<expected>
				<value xsi:type="xsd:decimal">1</value>
			</expected>
		</resultNode>
		<resultNode name="seconds" type="decision">
			<expected>
				<value xsi:type="xsd:decimal">14</value>
			</expected>
		</resultNode>
	</testCase>
</testCases>
