<?xml version="1.0" encoding="UTF-8"?>
<testCases
		xmlns="http://www.omg.org/spec/DMN/20160719/testcase"
		xmlns:xsi="http://www.w3.org/2001/XMLSchema-instance"
		xsi:schemaLocation="http://www.omg.org/spec/DMN/20160719/testcase ../../testCases.xsd"
		xmlns:xsd="http://www.w3.org/2001/XMLSchema"
		namespace="http://www.provider.com/definitions/decisions"
>
	<modelName>decisionTables</modelName>
	<testCase id="001">
		<inputNode name="structA" namespace="http://www.provider.com/definitions/decision-inputs">
			<component name="name">
				<value xsi:type="xsd:string">widget</value>
			</component>
			<component name="price">
				<value xsi:type="xsd:decimal">20</value>
			</component>
		</inputNode>
		<resultNode name="priceGt10" type="decision">
			<expected>
				<value xsi:type="xsd:boolean">true</value>
			</expected>
		</resultNode>
	</testCase>
	<testCase id="002">
		<inputNode name="structA" namespace="http://www.provider.com/definitions/decision-inputs">
			<component name="name">
				<value xsi:type="xsd:string">widget</value>
			</component>
			<component name="price">
				<value xsi:type="xsd:decimal">20</value>
			</component>
		</inputNode>
		<inputNode name="numB" namespace="http://www.provider.com/definitions/decision-inputs">
			<value xsi:type="xsd:decimal">9</value>
		</inputNode>
		<inputNode name="numC" namespace="http://www.provider.com/definitions/decision-inputs">
			<value xsi:type="xsd:decimal">10</value>
		</inputNode>
		<resultNode name="priceInRange" type="decision">
			<expected>
				<value xsi:type="xsd:string">Not in range</value>
			</expected>
		</resultNode>
	</testCase>
	<testCase id="003">
		<inputNode name="dateD" namespace="http://www.provider.com/definitions/decision-inputs">
			<value xsi:type="xsd:date">2016-11-01</value>
		</inputNode>
		<resultNode name="dateCompare1" type="decision">
			<expected>
				<value xsi:type="xsd:boolean">true</value>
			</expected>
		</resultNode>
	</testCase>
	<testCase id="004">
		<inputNode name="dateD" namespace="http://www.provider.com/definitions/decision-inputs">
			<value xsi:type="xsd:date">2016-11-01</value>
		</inputNode>
		<inputNode name="dateE" namespace="http://www.provider.com/definitions/decision-inputs">
			<value xsi:type="xsd:date">2016-11-02</value>
		</inputNode>
		<resultNode name="dateCompare2" type="decision">
			<expected>
				<value xsi:type="xsd:boolean">false</value>
			</expected>
		</resultNode>
	</testCase>
</testCases>