<?xml version="1.0" encoding="UTF-8"?>
<testCases xmlns="http://www.omg.org/spec/DMN/20160719/testcase" xmlns:xsi="http://www.w3.org/2001/XMLSchema-instance" xsi:schemaLocation="http://www.omg.org/spec/DMN/20160719/testcase ../../testCases.xsd" xmlns:xsd="http://www.w3.org/2001/XMLSchema">
	<modelName>0002-string-functions.dmn</modelName>
	<labels>
		<label>Compliance Level 3</label>
		<label>Literal Expression</label>
		<label>Context</label>
		<label>Item Definition</label>
		<label>FEEL Functions: strings</label>
		<label>FEEL Arithmetic</label>
		<label>FEEL Filter (10.3.2.5)</label>
		<label>FEEL Functions: string</label>
		<label>FEEL Functions: string</label>
		<label>Data Type: String</label>
		<label>Data Type: Number</label>
		<label>Data Type: Boolean</label>
		<label>Data Type: Structure</label>
	</labels>
	<testCase id="001">
		<description>Tests FEEL built-in functions on string literals (starts_with, ends_with, contains, substring, string_length, upper_case, lower_case, substring_before, substring_after)</description>
		<inputNode name="A">
			<value xsi:type="xsd:string">banana</value>
		</inputNode>
		<inputNode name="B">
			<value xsi:type="xsd:string">a</value>
		</inputNode>
		<inputNode name="NumC">
			<value xsi:type="xsd:decimal">2</value>
		</inputNode>
		<resultNode name="Basic" type="decision">
			<expected>
				<component name="startsWithX">
					<value xsi:type="xsd:boolean">false</value>
				</component>
				<component name="startsWithB">
					<value xsi:type="xsd:boolean">false</value>
				</component>
				<component name="endsWithX">
					<value xsi:type="xsd:boolean">false</value>
				</component>
				<component name="endsWithB">
					<value xsi:type="xsd:boolean">true</value>
				</component>
				<component name="containsX">
					<value xsi:type="xsd:boolean">false</value>
				</component>
				<component name="containsB">
					<value xsi:type="xsd:boolean">true</value>
				</component>
				<component name="substringC1">
					<value xsi:type="xsd:string">a</value>
				</component>
				<component name="stringlength">
					<value xsi:type="xsd:decimal">6</value>
				</component>
				<component name="uppercase">
					<value xsi:type="xsd:string">BANANA</value>
				</component>
				<component name="lowercase">
					<value xsi:type="xsd:string">a</value>
				</component>
				<component name="substringBeforeB">
					<value xsi:type="xsd:string">b</value>
				</component>
				<component name="substringAfterB">
					<value xsi:type="xsd:string">nana</value>
				</component>
			</expected>
		</resultNode>
	</testCase>
	<testCase id="002">
		<description>Tests FEEL built-in function for regular expresssion matching (matches)</description>
		<inputNode name="A">
			<value xsi:type="xsd:string">banana</value>
		</inputNode>
		<resultNode name="Matches" type="decision">
			<expected>
				<value xsi:type="xsd:boolean">true</value>
			</expected>
		</resultNode>
	</testCase>
	<testCase id="003">
		<description>Tests FEEL built-in function 'replace' on string literals</description>
		<inputNode name="A">
			<value xsi:type="xsd:string">banana</value>
		</inputNode>
		<resultNode name="Replace" type="decision">
			<expected>
				<component name="Aao">
					<value xsi:type="xsd:string">bonono</value>
				</component>
				<component name="AanplusStarstar">
					<value xsi:type="xsd:string">b**a</value>
				</component>
				<component name="encloseVowels">
					<value xsi:type="xsd:string">b[a]n[a]n[a]</value>
				</component>
			</expected>
		</resultNode>
	</testCase>
	<testCase id="004">
		<description>Tests FEEL built-in function for converting a number to a string</description>
		<inputNode name="NumC">
			<value xsi:type="xsd:decimal">2</value>
		</inputNode>
		<resultNode name="Constructor" type="decision">
			<expected>
				<value xsi:type="xsd:string">2</value>
			</expected>
		</resultNode>
	</testCase>
</testCases>