<?xml version="1.0" encoding="UTF-8"?>
<testCases xmlns="http://www.omg.org/spec/DMN/20160719/testcase" xmlns:xsi="http://www.w3.org/2001/XMLSchema-instance" xsi:schemaLocation="http://www.omg.org/spec/DMN/20160719/testcase ../../testCases.xsd" xmlns:xsd="http://www.w3.org/2001/XMLSchema">
	<modelName>0017-tableTests.dmn</modelName>
	<labels>
		<label>Compliance Level 3</label>
		<label>Literal Expression</label>
		<label>Item Definition</label>
		<label>Decision Table: Single Output</label>
		<label>Hit Policy: UNIQUE</label>
		<label>Hit Policy: PRIORITY</label>
		<label>FEEL Arithmetic</label>
		<label>FEEL Functions: date and time</label>
		<label>Data Type: String</label>
		<label>Data Type: Number</label>
		<label>Data Type: Boolean</label>
		<label>Data Type: Structure</label>
		<label>Data Type: Collection</label>
		<label>Data Type: Date</label>
	</labels>
	<testCase id="001">
		<inputNode name="structA">
			<component name="name">
				<value>widget</value>
			</component>
			<component name="price">
				<value>20</value>
			</component>
		</inputNode>
		<resultNode name="priceGt10" type="decision">
			<expected>
				<value>true</value>
			</expected>
		</resultNode>
	</testCase>
	<testCase id="002">
		<inputNode name="structA">
			<component name="name">
				<value>widget</value>
			</component>
			<component name="price">
				<value>20</value>
			</component>
		</inputNode>
		<inputNode name="numB">
			<value>9</value>
		</inputNode>
		<inputNode name="numC">
			<value>10</value>
		</inputNode>
		<resultNode name="priceInRange" type="decision">
			<expected>
				<value>Not in range</value>
			</expected>
		</resultNode>
	</testCase>
	<testCase id="003">
		<inputNode name="dateD">
			<value xsi:type="xsd:date">2016-11-01</value>
		</inputNode>
		<resultNode name="dateCompare1" type="decision">
			<expected>
				<value>true</value>
			</expected>
		</resultNode>
	</testCase>
	<testCase id="004">
		<inputNode name="dateD">
			<value xsi:type="xsd:date">2016-11-01</value>
		</inputNode>
		<inputNode name="dateE">
			<value xsi:type="xsd:date">2016-11-02</value>
		</inputNode>
		<resultNode name="dateCompare2" type="decision">
			<expected>
				<value>false</value>
			</expected>
		</resultNode>
	</testCase>
</testCases>